{
  "schemaVersion": "1.0.0",
  "id": "view-90",
  "name": "90° isometric",
  "kind": "isometric",
  "azimuth": 90,
  "elevation": 35.264,
  "matrix": [
    4.7761225166746774e-17,
    -0.78,
    0.35100000000000003,
    2.1492551325036047e-17
  ],
  "origin": {
    "x": 480,
    "y": 130
  },
  "scale": 7
}
