{
  "schemaVersion": "1.0.0",
  "id": "view-180",
  "name": "180\u00b0 isometric",
  "kind": "isometric",
  "azimuth": 180,
  "elevation": 35.264,
  "matrix": [
    0.8660000000000002,
    -0.8659999999999999,
    -0.49999999999999994,
    -0.5000000000000001
  ],
  "origin": {
    "x": 372.4999999999999,
    "y": 568.2678983833719
  },
  "scale": 1.0344495765973825
}
